Hearing Clinic,hearing-clinic,68df026d0133a76106f67e29,68cc952cdf0724cd25ca06a3,68df211a3a3f8f2824f1c997,false,false,Fri Oct 03 2025 01:04:26 GMT+0000 (Coordinated Universal Time),Fri Oct 03 2025 01:04:26 GMT+0000 (Coordinated Universal Time),Fri Oct 03 2025 02:42:28 GMT+0000 (Coordinated Universal Time),Hearing Clinic App: Lock In Annual Check-Ups & Product Sales,Lock In Annual Hearing Clinic Check-Ups for your business for $650/mo.,Guarantee Annual Check-Ups and Secure Repeat Hearing Aid and Product Sales.,Keep loyal patients coming back to your Hearing Clinic with Buildify. Get started for $650 per month.,"Without a loyalty incentive for annual hearing aid checks, patients needing ""hearing loss solutions"" skip vital appointments, risking equipment failure and reducing their trust in your long-term care.","Over the weekend, create loyalty credits for routine refreshes. Manage the points and scheduling exclusively through your client app to keep the order book consistently open.",Build Long-Term Trust with Loyalty for Annual Hearing Aid Checks.,Create Loyalty Credits: Implement loyalty credits for routine refreshes and annual hearing aid maintenance checks.,Prevent Equipment Failure: Manage the points and scheduling exclusively through your client app to prevent equipment failure.,"Long-Term Care: Stop patients needing ""hearing loss solutions"" from skipping vital appointments, reducing their trust.","Patients skipped vital annual checks, risking equipment failure. By creating loyalty credits for routine refreshes (annual hearing aid checks) and managing them exclusively through our client app, we keep the order book consistently open. We've built long-term trust in our care.",Dr. Paul Evans,Clarity Hearing Solutions
Herbalist Shop,herbalist-shop,68df026d0133a76106f67e29,68cc952cdf0724cd25ca06a3,68df211beda329be910033af,false,false,Fri Oct 03 2025 01:04:27 GMT+0000 (Coordinated Universal Time),Fri Oct 03 2025 01:04:27 GMT+0000 (Coordinated Universal Time),Fri Oct 03 2025 02:42:28 GMT+0000 (Coordinated Universal Time),Herbalist App: Establish Your Shop as a Long-Term Resource,Establish Your Herbalist Shop as a Long-Term Resource for $650/mo.,Establish Your Shop as the Go-To Source for Long-Term Wellness Needs.,Build community around your Herbalist Shop with Buildify. Launch your loyalty app today for $650/mo.,"Ignoring the opportunity to bundle seasonal items into a discounted wellness package means customers seeking ""natural sleep remedies"" treat your herbalist shop as a last resort, not a long-term resource.","Before you open for the day, credit scheduled checkups with a discount. Centralize the entire system in a customer loyalty app to ensure planned work replaces emergencies.",Establish Your Shop as a Long-Term Wellness Resource.,Credit Scheduled Checkups: Offer a discounted wellness package and credit scheduled checkups with a discount.,Ensure Planned Work: Centralize the entire system in a customer loyalty app to ensure planned maintenance replaces emergencies.,"Stop Last Resort: Stop customers seeking ""natural sleep remedies"" from treating your shop as a last resort.","Customers treated us as a last resort, not a long-term resource. By crediting scheduled checkups with a discount (discounted wellness package) and centralizing the entire system in a customer loyalty app, planned work replaces emergencies. We've established ourselves as their long-term resource.",Dr. Emily Chen,The Naturalist Herbals
Home Cleaning Service,home-cleaning-service,68df026d0133a76106f67e29,68cc952cdf0724cd25ca06a3,68df21159861e98f202d6b0d,false,false,Fri Oct 03 2025 01:04:21 GMT+0000 (Coordinated Universal Time),Fri Oct 03 2025 01:04:21 GMT+0000 (Coordinated Universal Time),Fri Oct 03 2025 02:42:28 GMT+0000 (Coordinated Universal Time),Home Cleaning App: Lock In Consistent Subscription Income,Lock In Consistent Home Cleaning Subscriptions for your service for $650/mo.,Reduce Churn on Weekly/Bi-Weekly Service Plans with High-Value Rewards.,Keep loyal customers coming back to your Home Cleaning Service with Buildify. Your loyalty program from $650 per month.,"Without a structured referral bonus or loyalty program for bi-weekly service, your best residential customers quietly drift away, leaving you with the financial regret of not securing their dependable, recurring revenue.","By 8 am Monday, create a rewards program for bi-weekly bookings. Manage the points and scheduling exclusively through your customer loyalty app to secure dependable recurring revenue.","Secure Dependable, Recurring Revenue from Your Best Residential Clients.",Create a Bi-Weekly Rewards Program: Manage points and scheduling exclusively through your loyalty app for consistent bookings.,Stop Customer Drift: Secure your best residential customers from quietly drifting away to competitors.,"Eliminate Financial Regret: Guarantee dependable, recurring revenue by securing customer loyalty and eliminating volatility.","Our income was always unpredictable due to client cancellations. After deploying a class-pack renewal bonus for returning members through a mobile loyalty platform, we secured reliable monthly subscription income. We've achieved the stable, reliable income we needed.",Alicia Mendez,Sparkling Homes Co.
Home Decor Shop,home-decor-shop,68df026d0133a76106f67e29,68cc952cdf0724cd25ca06a3,68df211fd3e1ff5fffc0bd60,false,false,Fri Oct 03 2025 01:04:31 GMT+0000 (Coordinated Universal Time),Fri Oct 03 2025 01:04:31 GMT+0000 (Coordinated Universal Time),Fri Oct 03 2025 02:42:28 GMT+0000 (Coordinated Universal Time),Home Decor App: Secure Predictable Profit from Loyal Following,Secure Predictable Profit from a Dedicated Following for your Home Decor Shop for $650/mo.,Secure Predictable Sales by Building a Loyal Following for Seasonal Products.,Build repeat business at your Home Decor Shop with Buildify. A loyalty app starting at $650/mo.,"Without an exclusive restock alert and discount for home decor buyers, customers needing seasonal wall art shop at big-box stores, losing the predictable profit that comes from having a dedicated in-store following.","Over the weekend, offer loyalty points for product purchases and pre-booked color boosts. Schedule redemptions directly through your mobile loyalty platform to secure reliable long-term revenue.",Capture Predictable Profit with an Exclusive Restock Alert.,Offer Loyalty Points: Offer an exclusive restock alert and discount for home decor buyers and loyalty points for product purchases.,Secure Reliable Revenue: Schedule redemptions directly through your mobile loyalty platform to secure reliable long-term revenue.,"Stop Big-Box: Stop customers needing seasonal wall art from shopping at big-box stores, securing predictable in-store profit.","Customers shopped at big-box stores, losing the predictable profit from a dedicated following. By offering loyalty points for product purchases and pre-booked color boosts (exclusive restock alert) scheduled directly through our mobile loyalty platform, we secure reliable long-term revenue. We've secured predictable in-store profit.",Mark Johnson,The Decor Loft
Home Health Service,home-health-service,68df026d0133a76106f67e29,68cc952cdf0724cd25ca06a3,68df21195b2f2315e795ac8a,false,false,Fri Oct 03 2025 01:04:25 GMT+0000 (Coordinated Universal Time),Fri Oct 03 2025 01:04:25 GMT+0000 (Coordinated Universal Time),Fri Oct 03 2025 02:42:28 GMT+0000 (Coordinated Universal Time),Home Health App: Build Trust & Secure Repeat Contracts,Build Trust & Secure Repeat Home Health Contracts for your service for $650/mo.,Build Family Trust and Ensure Compliance with Treatment and Scheduling.,Keep loyal clients coming back to your Home Health Service with Buildify. Launch your loyalty app today for $650/mo.,"If you don't reward recurring clients with a discounted monthly check-in, families needing ""in-home wound care"" feel like a transaction, missing the full expertise of your certified nurses.","Over the weekend, set up automated maintenance credits for inspections. Use your loyalty platform to push reminders, ensuring a steady, full calendar.",Capture Full Expertise Revenue by Rewarding Recurring Client Check-ins.,Set Up Automated Credits: Implement maintenance credits for inspections and a discounted monthly check-in for recurring clients.,"Ensure Steady Calendar: Use your loyalty platform to push reminders, ensuring a steady, full calendar of recurring clients.","Full Expertise: Stop families needing ""in-home wound care"" from feeling like a transaction, ensuring they see the full expertise of your certified nurses.","Families needing 'in-home wound care' felt like a transaction. By setting up automated maintenance credits for inspections (discounted check-in) and pushing reminders via our loyalty platform, we ensure a steady, full calendar. We've become their trusted, long-term care provider.",David Chen,Premier Home Health
Home Remodeling Company,home-remodeling-company,68df026d0133a76106f67e29,68cc952cdf0724cd25ca06a3,68df21165993809ae34c9583,false,false,Fri Oct 03 2025 01:04:22 GMT+0000 (Coordinated Universal Time),Fri Oct 03 2025 01:04:22 GMT+0000 (Coordinated Universal Time),Fri Oct 03 2025 02:42:28 GMT+0000 (Coordinated Universal Time),Home Remodeling App: Drive Repeat Project Bookings & Referrals,Drive Repeat Project Bookings for your Home Remodeling Company for $650/mo.,Generate High-Value Leads for Your Next Remodel Directly from Past Clients.,Turn first-time visitors into loyal patrons at your Home Remodeling Company with Buildify. A loyalty app starting at $650/mo.,"Not maintaining a customer database to offer exclusive remodeling package previews means you lose the opportunity to quote the bigger job, regretting the massive lifetime revenue that slipped away.","By Monday morning, invite clients back for finishing care with a small credit. Manage this incentive directly in a client app to immediately earn trust for future large-scale projects.",Capture Massive Lifetime Revenue by Converting Remodels into Referrals.,Incentivize Finishing Care: Invite clients back for finishing care with a small credit after the large job.,Earn Future Quotes: Manage this incentive directly in a client app to immediately earn trust for future large-scale projects.,"Secure Massive Lifetime Revenue: Maintain a database to offer exclusive previews, capturing the next big job quote.","Getting clients to return for a second or third project was a huge challenge. By setting up automated maintenance credits for inspections (design consultations) and pushing reminders through our loyalty platform, we ensure a steady, full calendar. We've converted past clients into a predictable source of high-margin work.",Brenda Lopez,Harmony Home Remodeling
Hot Yoga Studio,hot-yoga-studio,68df026d0133a76106f67e29,68cc952cdf0724cd25ca06a3,68df211ea95011c01a5d7d58,false,false,Fri Oct 03 2025 01:04:30 GMT+0000 (Coordinated Universal Time),Fri Oct 03 2025 01:04:30 GMT+0000 (Coordinated Universal Time),Fri Oct 03 2025 02:42:28 GMT+0000 (Coordinated Universal Time),Hot Yoga App: Secure Long-Term Membership Commitment,Secure Long-Term Hot Yoga Membership Commitment for your business for $650/mo.,Reduce Membership Freeze Requests and Secure Long-Term Loyalty.,Turn first-time visitors into loyal patrons at your Hot Yoga Studio with Buildify. Your loyalty program from $650 per month.,"Skipping the creation of a ""class pack renewal bonus"" ensures members seeking ""hot yoga for beginners"" buy from the next studio offering an introductory deal.","Before the first appointment of the week, create a rewards program for bi-weekly bookings. Manage the points and scheduling exclusively through your customer loyalty app to secure dependable recurring revenue.",Secure Dependable Recurring Revenue by Rewarding Renewals.,"Create a Rewards Program: Offer a ""class pack renewal bonus"" and a rewards program for bi-weekly bookings.",Secure Dependable Revenue: Manage the points and scheduling exclusively through your customer loyalty app to secure dependable recurring revenue.,"Stop Introductory Deals: Stop members seeking ""hot yoga for beginners"" from buying from the next studio offering an introductory deal.","Members bought from the next studio offering an introductory deal. By creating a rewards program for bi-weekly bookings (class pack renewal bonus) managed exclusively through our customer loyalty app, we secure dependable recurring revenue. We've secured long-term commitment from our members.",Lisa Rodriguez,Inferno Hot Yoga
IT Services Company,it-services-company,68df026d0133a76106f67e29,68cc952cdf0724cd25ca06a3,68df211f4cfa9c4485bbc276,false,false,Fri Oct 03 2025 01:04:31 GMT+0000 (Coordinated Universal Time),Fri Oct 03 2025 01:04:31 GMT+0000 (Coordinated Universal Time),Fri Oct 03 2025 02:42:28 GMT+0000 (Coordinated Universal Time),"IT Services App: Lock In Stable, Recurring Managed Revenue","Lock In Stable, Recurring Managed IT Revenue for your company for $650/mo.",Guarantee Annual Managed IT Contracts and Secure Future Hardware Upgrades.,Build repeat business at your IT Services Company with Buildify. A loyalty app starting at $650/mo.,"Without a clear discount for long-term managed services, businesses seeking IT support for small business switch providers annually, robbing your firm of stable recurring revenue.","Before the first patient arrives, set up automated maintenance credits for inspections. Use your loyalty platform to push reminders, ensuring a steady, full calendar.",Secure Stable Recurring Revenue with Long-Term Managed Services.,Set Up Automated Credits: Offer a clear discount for long-term managed services and automated maintenance credits.,"Ensure Steady Calendar: Use your loyalty platform to push reminders, ensuring a steady, full calendar of recurring revenue.",Stop Provider Switch: Stop businesses seeking IT support for small business from switching providers annually.,"Businesses switched providers annually, robbing us of stable recurring revenue. By setting up automated maintenance credits for inspections (long-term managed services discount) and pushing reminders via our loyalty platform, we ensure a steady, full calendar. We've secured stable, recurring IT revenue.",Paul Miller,Digital Secure IT
Ice Cream Shop,ice-cream-shop,68df026d0133a76106f67e29,68cc952cdf0724cd25ca06a3,68df21174e50daf4138882b6,false,false,Fri Oct 03 2025 01:04:23 GMT+0000 (Coordinated Universal Time),Fri Oct 03 2025 01:04:23 GMT+0000 (Coordinated Universal Time),Fri Oct 03 2025 02:42:28 GMT+0000 (Coordinated Universal Time),Ice Cream Shop App: Increase Consistent Customer Traffic,Increase Consistent Ice Cream Shop Traffic for your business for $650/mo.,Boost Family Visits and Turn Slow Afternoons into Reliable Sales Periods.,Grow repeat business at your Ice Cream Shop with Buildify. Loyalty made simple at $650/mo.,"Without an easy-to-use birthday reward or ""buy X scoops get 1 free"" system, parents treat your shop as a one-time treat, causing your annual sales goals to be constantly undermined by low repeat traffic.","Before the week begins, add a bonus credit for recurring family visits. Track all credits and reminders exclusively via your mobile loyalty portal for high-value repeat visits.",Boost Annual Sales Goals by Rewarding Recurring Family Visits.,Add a Bonus Credit: Offer a bonus credit and a birthday reward for recurring family visits and frequent purchases.,Eliminate Low Repeat Traffic: Track all credits and reminders exclusively via your mobile loyalty portal to hit annual sales goals.,"Convert Sporadic Treat: Stop parents from treating your shop as a one-time indulgence by driving repeat, high-value visits.","Parents treated our shop as a one-time treat, hurting our annual sales goals. By adding a bonus credit for recurring family visits tracked exclusively via our mobile loyalty portal, we secure high-value repeat visits. Our annual sales goals are no longer undermined by low traffic.",Sarah Johnson,Sweet Scoops Ice Cream
Italian Deli,italian-deli,68df026d0133a76106f67e29,68cc952cdf0724cd25ca06a3,68df2117fe70294ba8060e7b,false,false,Fri Oct 03 2025 01:04:23 GMT+0000 (Coordinated Universal Time),Fri Oct 03 2025 01:04:23 GMT+0000 (Coordinated Universal Time),Fri Oct 03 2025 02:42:28 GMT+0000 (Coordinated Universal Time),Deli Loyalty App: Turn First-Time Visitors into Loyal Patrons,Turn First-Time Visitors into Loyal Deli Patrons for $650/mo.,Convert Lunch Rush Clients into Catering and Family Dinner Pack Orders.,Keep loyal customers coming back to your Italian Deli with Buildify. Loyalty made simple at $650/mo.,"Skipping a simple sandwich punch card or weekly special reward means customers quickly forget the quality of your deli, guaranteeing they'll walk into the next similar shop for lunch.","Before the lunch rush, activate a punch card system for sandwich purchases. Track progress via a digital loyalty app to keep your shop the automatic choice for lunch.",Make Your Deli the Automatic Lunch Choice with a Simple Punch Card.,"Activate Digital Punch Card: Set up a quick, app-based punch card system for sandwich and weekly special purchases.",Eliminate Customer Forgetfulness: Track progress via a digital loyalty app to keep your deli top-of-mind for every lunch break.,Increase Lunch Frequency: Guarantee customers walk into your deli instead of the next similar shop for their mid-day meal.,"My customers quickly forgot about us and walked into the next deli. By activating a punch card system for sandwich purchases tracked via a digital loyalty app, we became the automatic choice for lunch. Now, our quality deli is never forgotten.",Antonio Rossi,Rossi's Deli
Jewelry Store,jewelry-store,68df026d0133a76106f67e29,68cc952cdf0724cd25ca06a3,68df211bad920b2b6075d708,false,false,Fri Oct 03 2025 01:04:27 GMT+0000 (Coordinated Universal Time),Fri Oct 03 2025 01:04:27 GMT+0000 (Coordinated Universal Time),Fri Oct 03 2025 02:42:28 GMT+0000 (Coordinated Universal Time),Jewelry Store App: Capture All Milestone Purchases,Capture All Future Jewelry Milestone Purchases for your business for $650/mo.,Guarantee Your Store is Used for All Future Milestone and Anniversary Purchases.,Keep loyal shoppers coming back to your Jewelry Store with Buildify. Get started for $650 per month.,"Not maintaining a customer database to offer anniversary discounts means clients seeking ""engraved necklaces"" forget your shop when they return for high-value gift purchases.","Before you check your emails, create loyalty credits for routine refreshes. Manage the points and scheduling exclusively through your client app to keep the order book consistently open.",Capture High-Value Gift Purchases with Anniversary Discounts.,Create Loyalty Credits: Implement loyalty credits for routine refreshes and anniversary discounts on high-value items.,Keep Order Book Open: Manage the points and scheduling exclusively through your client app to keep the order book consistently open.,"Stop Forgetting: Stop clients seeking ""engraved necklaces"" from forgetting your shop when they return for high-value gift purchases.","Clients forgot our shop when they returned for high-value gift purchases. By creating loyalty credits for routine refreshes (anniversary discount) and managing them exclusively through our client app, we keep the order book consistently open. We've secured all their high-value milestones.",Sarah Davies,Precious Gems Jewelry
Juice Bar,juice-bar,68df026d0133a76106f67e29,68cc952cdf0724cd25ca06a3,68df2117880f7d2d64a1af17,false,false,Fri Oct 03 2025 01:04:23 GMT+0000 (Coordinated Universal Time),Fri Oct 03 2025 01:04:23 GMT+0000 (Coordinated Universal Time),Fri Oct 03 2025 02:42:28 GMT+0000 (Coordinated Universal Time),Juice Bar App: Secure Recurring Wellness Cleanse Subscriptions,Secure Recurring Wellness Cleanse Subscriptions for your Juice Bar for $650/mo.,Secure Weekly Juice Cleanse and Subscription Revenue from Loyal Customers.,Encourage word-of-mouth for your Juice Bar with Buildify. Get started for $650 per month.,"Not offering a discounted weekly cleanse package for health-conscious patrons means they constantly shop around, robbing your juice bar of the dependable revenue stream from their commitment to wellness.","Before the week opens, set up automated preferred client rates for weekly cleanse packages. Use your loyalty platform to push reminders and track usage, securing steady health-conscious clientele.","Secure Steady, Dependable Revenue from Health-Conscious Clientele.",Automate Preferred Rates: Set up preferred client rates for discounted weekly cleanse packages and subscriptions.,"Guarantee Commitment: Use your loyalty platform to push reminders and track usage, eliminating client shopping around.",Dependable Wellness Stream: Secure the dependable revenue stream from their consistent commitment to wellness.,"Health-conscious patrons constantly shopped around for cleanse packages. By setting up automated preferred client rates for weekly cleanse packages and pushing reminders via our loyalty platform, we secured a dependable revenue stream. We are now their automatic choice for wellness.",Chloe Davis,The Daily Squeeze
Junk Removal Company,junk-removal-company,68df026d0133a76106f67e29,68cc952cdf0724cd25ca06a3,68df2115dfb3fae2adfff496,false,false,Fri Oct 03 2025 01:04:21 GMT+0000 (Coordinated Universal Time),Fri Oct 03 2025 01:04:21 GMT+0000 (Coordinated Universal Time),Fri Oct 03 2025 02:42:28 GMT+0000 (Coordinated Universal Time),Junk Removal Loyalty App: Convert One-Time Jobs to Repeat Work,Convert One-Time Cleanouts to Predictable Work for your Junk Removal Company for $650/mo.,Encourage Repeat Cleanouts and Generate Neighborhood Referrals Automatically.,Keep loyal customers coming back to your Junk Removal Company with Buildify. Loyalty made simple at $650/mo.,"Without a repeat customer incentive, past clients forget your name after one job, forcing you to constantly spend more to acquire new customers instead of securing your base.","By Monday morning, set a generous return discount for seasonal cleanups and send a simple ""spring readiness"" checklist, ensuring useful, automated tools earn the next necessary job.",Secure Your Base with Automated Seasonal Cleanup Incentives.,Set a Generous Return Discount: Offer a significant discount for seasonal cleanups to secure the base.,"Earn Necessary Future Jobs: Send a simple ""spring readiness"" checklist to provide useful, automated tools.",Avoid Constant Acquisition Spend: Secure repeat customers instead of continuously spending more to acquire new ones.,"Repeat customers never called us until their next crisis. Since we set up automated maintenance credits for inspections using our loyalty platform, we push reminders to ensure a steady, full calendar. We've converted emergency calls into planned, predictable cleanouts.",Chloe Davies,Clear Space Junk Removal
Korean BBQ Restaurant,korean-bbq-restaurant,68df026d0133a76106f67e29,68cc952cdf0724cd25ca06a3,68df211799077828201e4c0f,false,false,Fri Oct 03 2025 01:04:23 GMT+0000 (Coordinated Universal Time),Fri Oct 03 2025 01:04:23 GMT+0000 (Coordinated Universal Time),Fri Oct 03 2025 02:42:28 GMT+0000 (Coordinated Universal Time),Korean BBQ App: Lock In High-Volume Group Reservations,Lock In High-Volume Group Reservations for your Korean BBQ Restaurant for $650/mo.,Fill Off-Peak Hours by Rewarding Loyalty During Less Busy Times.,Turn first-time visitors into loyal patrons at your Korean BBQ Restaurant with Buildify. Your loyalty program from $650 per month.,"Ignoring the chance to offer a preferred status for large group reservations means you lose out on the reliable, high-volume income from your most important corporate or family clients.","Before the week opens, set up automated reservation rewards for consistent large group bookings. Use your loyalty platform to push reminders, ensuring consistent, high-ticket volume.","Capture Reliable, High-Volume Income from Large Group Bookings.",Automate Reservation Rewards: Set up automated rewards for consistent large group and corporate reservations.,"Ensure Consistent Volume: Use your loyalty platform to push reminders, securing consistent, high-ticket volume.",Preferred Status Recognition: Recognize your most important corporate or family clients with preferred status perks.,"Ignoring large group reservations meant losing high-volume income. By setting up automated reservation rewards for consistent large group bookings and using our loyalty platform to push reminders, we ensure consistent, high-ticket volume. We've secured the reliable income from our best clients.",Min-Jee Park,Seoul Grill House
