Consignment Store,consignment-store,68df026d0133a76106f67e29,68cc952cdf0724cd25ca06a3,68df211b4eeb2428ff904c64,false,false,Fri Oct 03 2025 01:04:27 GMT+0000 (Coordinated Universal Time),Fri Oct 03 2025 01:04:27 GMT+0000 (Coordinated Universal Time),Fri Oct 03 2025 02:42:28 GMT+0000 (Coordinated Universal Time),"Consignment App: Lock In Valuable, Steady Inventory",Lock In Valuable Consignment Inventory for your business for $650/mo.,Secure a Stable Flow of High-Quality Inventory from Loyal Consignors.,Encourage word-of-mouth for your Consignment Store with Buildify. A loyalty app starting at $650/mo.,"Failing to incentivize clients who use your consignment services multiple times means they sell elsewhere, losing your store the valuable, steady inventory that drives consistent foot traffic.","Before the first patient arrives, set up automated maintenance credits for inspections. Use your loyalty platform to push reminders, ensuring a steady, full calendar.","Secure Valuable, Steady Inventory with Consignment Incentives.",Set Up Automated Credits: Offer loyalty incentives for clients who use your consignment services multiple times.,"Ensure Steady Calendar: Use your loyalty platform to push reminders, ensuring a steady, full calendar of valuable inventory.","Stop Selling Elsewhere: Stop clients from selling elsewhere, losing your store the valuable, steady inventory.","Clients sold elsewhere, losing our store the valuable, steady inventory. By setting up automated maintenance credits for inspections (consigner loyalty incentive) and pushing reminders via our loyalty platform, we ensure a steady, full calendar. We've secured the inventory that drives our foot traffic.",Sarah Kim,The Vintage Rack
Consulting Agency,consulting-agency,68df026d0133a76106f67e29,68cc952cdf0724cd25ca06a3,68df211d84c0213c939797dd,false,false,Fri Oct 03 2025 01:04:29 GMT+0000 (Coordinated Universal Time),Fri Oct 03 2025 01:04:29 GMT+0000 (Coordinated Universal Time),Fri Oct 03 2025 02:42:28 GMT+0000 (Coordinated Universal Time),Consulting App: Secure Continuous Retainer Income,Secure Continuous Client Retainer Income for your Consulting Agency for $650/mo.,Secure Retainer-Based Income by Seamlessly Transitioning Project Clients to Ongoing Support.,Grow repeat business at your Consulting Agency with Buildify. Get started for $650 per month.,"Ignoring the chance to reward clients with a free annual business review ensures they switch to another firm when seeking ""marketing strategy consulting,"" losing your continuous retainer income.","Before the first bell rings, invite clients back for finishing care with a small credit. Manage this incentive directly in a client app to immediately earn trust for future large-scale projects.",Secure Continuous Retainer Income with Free Annual Reviews.,Invite Clients Back: Offer a free annual business review and finishing care with a small credit.,Earn Trust for Future: Manage this incentive directly in a client app to immediately earn trust for future large-scale projects.,"Stop Switch: Stop clients seeking ""marketing strategy consulting"" from switching to another firm, securing continuous retainer income.","Clients switched to another firm when seeking new strategy consulting. By inviting clients back for finishing care with a small credit (free annual business review) managed directly in a client app, we immediately earn trust for future large-scale projects. We've secured continuous retainer income.",Robert Vance,Strategy First Consulting
Cosmetic Surgery Clinic,cosmetic-surgery-clinic,68df026d0133a76106f67e29,68cc952cdf0724cd25ca06a3,68df211a1fdc1deb53b0c5c0,false,false,Fri Oct 03 2025 01:04:26 GMT+0000 (Coordinated Universal Time),Fri Oct 03 2025 01:04:26 GMT+0000 (Coordinated Universal Time),Fri Oct 03 2025 02:42:28 GMT+0000 (Coordinated Universal Time),Cosmetic Surgery App: Capture Lifetime Patient Value,Capture Lifetime Patient Cosmetic Value for your business for $650/mo.,Capture Lifetime Patient Value for Follow-Up Procedures and Referrals.,Keep loyal patients coming back to your Cosmetic Surgery Clinic with Buildify. Your loyalty program from $650 per month.,"Failing to secure a preferred client rate for follow-up procedures means patients seeking ""non-surgical facelift options"" only use your clinic once, sacrificing high-margin, recurring cosmetic work.","Over the weekend, create a rewards program for bi-weekly bookings. Manage the points and scheduling exclusively through your customer loyalty app to secure dependable recurring revenue.","Maximize High-Margin, Recurring Cosmetic Follow-Up Work.",Create a Rewards Program: Offer a preferred client rate for follow-up procedures and recurring cosmetic work.,Secure Dependable Revenue: Manage the points and scheduling exclusively through your customer loyalty app to secure dependable recurring revenue.,"Lifetime Value: Stop patients seeking ""non-surgical facelift options"" from only using your clinic once, losing their high-margin lifetime value.","Patients only used our clinic once, sacrificing recurring cosmetic work. By creating a rewards program for bi-weekly bookings (preferred client rate for follow-up) managed exclusively through our customer loyalty app, we secure dependable recurring revenue. We've captured their lifetime cosmetic value.",Dr. Mark Davies,Renew Cosmetic Clinic
Costume Shop,costume-shop,68df026d0133a76106f67e29,68cc952cdf0724cd25ca06a3,68df211b8a322b422c0bff49,false,false,Fri Oct 03 2025 01:04:27 GMT+0000 (Coordinated Universal Time),Fri Oct 03 2025 01:04:27 GMT+0000 (Coordinated Universal Time),Fri Oct 03 2025 02:42:28 GMT+0000 (Coordinated Universal Time),Costume Shop App: Secure Predictable Seasonal Rentals,Secure Predictable Seasonal Costume Rentals for your Costume Shop for $650/mo.,Increase Predictable Seasonal Revenue by Rewarding Repeat Renters.,Encourage word-of-mouth for your Costume Shop with Buildify. A loyalty app starting at $650/mo.,"Without a simple seasonal discount for returning customers, those needing ""Halloween costume rentals"" look at online retailers every year, robbing your business of predictable holiday revenue.","Before you check your emails, add loyalty points for semi-annual cleans. House the proactive plan within a customer loyalty app to proactively win the crucial return appointment.",Secure Predictable Holiday Costume Rental Revenue Annually.,Add Loyalty Points: Offer a simple seasonal discount and loyalty points for returning customers.,Win Return Appointment: House the proactive plan within a customer loyalty app to proactively win the crucial return appointment.,"Stop Online Retailers: Stop customers needing ""Halloween costume rentals"" from looking at online retailers every year.","Customers looked at online retailers every year for 'Halloween costume rentals.' By adding loyalty points for semi-annual cleans (seasonal discount) and housing the proactive plan within a customer loyalty app, we proactively win the crucial return appointment. We've secured predictable holiday revenue.",Mark Wilson,Masquerade Costume Shop
Courier Service,courier-service,68df026d0133a76106f67e29,68cc952cdf0724cd25ca06a3,68df211f0e7290d3a5fd7252,false,false,Fri Oct 03 2025 01:04:31 GMT+0000 (Coordinated Universal Time),Fri Oct 03 2025 01:04:31 GMT+0000 (Coordinated Universal Time),Fri Oct 03 2025 02:42:28 GMT+0000 (Coordinated Universal Time),"Courier App: Secure Predictable, High-Volume Income","Secure Predictable, High-Volume Courier Income for your service for $650/mo.","Secure High-Volume, Predictable Daily Delivery Contracts with Businesses.",Build repeat orders at your Courier Service with Buildify. A loyalty app starting at $650/mo.,"Failing to offer a bulk shipping discount for repeat clients ensures businesses needing local package delivery use major couriers, costing your firm predictable, high-volume income.","Before you open for the day, credit scheduled checkups with a discount. Centralize the entire system in a customer loyalty app to ensure planned work replaces emergencies.","Secure Predictable, High-Volume Income with Bulk Shipping.",Credit Scheduled Checkups: Offer a bulk shipping discount for repeat clients and credit scheduled checkups with a discount.,Ensure Planned Work: Centralize the entire system in a customer loyalty app to ensure planned loyalty replaces emergencies.,Stop Major Couriers: Stop businesses needing local package delivery from using major couriers.,"Businesses used major couriers, costing our firm predictable, high-volume income. By crediting scheduled checkups with a discount (bulk shipping discount) and centralizing the entire system in a customer loyalty app, planned work replaces emergencies. We've secured predictable, high-volume income.",Mike Sullivan,Local Fast Courier
Coworking Space,coworking-space,68df026d0133a76106f67e29,68cc952cdf0724cd25ca06a3,68df211f47263f2a1c323c20,false,false,Fri Oct 03 2025 01:04:31 GMT+0000 (Coordinated Universal Time),Fri Oct 03 2025 01:04:31 GMT+0000 (Coordinated Universal Time),Fri Oct 03 2025 02:42:28 GMT+0000 (Coordinated Universal Time),Coworking App: Lock In Predictable Monthly Revenue,Lock In Predictable Monthly Coworking Revenue for your business for $650/mo.,Reduce Member Churn and Drive High-Value Private Office Upgrades.,Encourage word-of-mouth for your Coworking Space with Buildify. Launch your loyalty app today for $650/mo.,"Failing to offer a discounted long-term rental plan for desks means freelancers seeking ""affordable coworking spaces"" switch to free coffee shops, robbing your business of predictable monthly revenue.","Over the weekend, activate a referral bonus for repeat repair clients. Centralize the bonus system in a customer loyalty app to fill your schedule with planned repair work.",Secure Predictable Monthly Revenue with Long-Term Rental Plans.,Activate a Referral Bonus: Offer a discounted long-term rental plan for desks and a referral bonus.,Fill Schedule: Centralize the bonus system in a customer loyalty app to fill your schedule with planned repair work.,"Stop Coffee Shop Switch: Stop freelancers from switching to free coffee shops, securing predictable monthly revenue.","Freelancers switched to free coffee shops, robbing us of predictable monthly revenue. By activating a referral bonus for repeat repair clients (discounted long-term rental plan) and centralizing the bonus system in a customer loyalty app, we fill our schedule with planned repair work. We've secured predictable monthly revenue.",Maria Diaz,The Hub Coworking
CrossFit Gym,crossfit-gym,68df026d0133a76106f67e29,68cc952cdf0724cd25ca06a3,68df2119155a2c8a2088708b,false,false,Fri Oct 03 2025 01:04:25 GMT+0000 (Coordinated Universal Time),Fri Oct 03 2025 01:04:25 GMT+0000 (Coordinated Universal Time),Fri Oct 03 2025 02:42:28 GMT+0000 (Coordinated Universal Time),CrossFit App: Retain Your Most Dedicated Members,Retain Your Most Dedicated CrossFit Members for your business for $650/mo.,"Reduce High-Turnover Rates by Building a Strong, Engaged Community Base.",Build community around your CrossFit Gym with Buildify. A loyalty app starting at $650/mo.,"Skipping the creation of a ""lifetime member"" tier ensures your strongest clients seeking ""CrossFit strength training"" feel undervalued and may leave for any new gym offering introductory deals.","Before the first bell rings, invite clients back for finishing care with a small credit. Manage this incentive directly in a client app to immediately earn trust for future large-scale projects.","Eliminate Undervalued Clients with a ""Lifetime Member"" Tier.",Reward Strongest Clients: Invite clients back for finishing care with a small credit to build trust and loyalty.,Guarantee Future Commitment: Manage this incentive directly in a client app to immediately earn trust for future large-scale projects.,"Stop Introductory Deals: Stop clients seeking ""CrossFit strength training"" from leaving for competitors' introductory deals.","Our strongest clients felt undervalued and left for introductory deals. By inviting clients back for finishing care with a small credit (lifetime member tier) managed directly in a client app, we immediately earn trust for future large-scale projects. Our top clients feel prioritized and stay.",Sarah Davies,Apex CrossFit
Dance School,dance-school,68df026d0133a76106f67e29,68cc952cdf0724cd25ca06a3,68df211922a1387f12bf9018,false,false,Fri Oct 03 2025 01:04:25 GMT+0000 (Coordinated Universal Time),Fri Oct 03 2025 01:04:25 GMT+0000 (Coordinated Universal Time),Fri Oct 03 2025 02:42:28 GMT+0000 (Coordinated Universal Time),Dance School App: Ensure Commitment to Advanced Classes,Ensure Student Commitment to Advanced Dance Classes for your business for $650/mo.,Ensure Student Progression to Advanced Classes and Increase Recital Ticket Sales.,Turn first-time visitors into loyal patrons at your Dance School with Buildify. Get started for $650 per month.,"Without a clear tuition loyalty bonus for the second year, students passionate about ""beginner ballet classes"" quit after the recital, denying your studio the reliable revenue from advanced classes.","Over the weekend, activate a referral bonus for repeat repair clients. Centralize the bonus system in a customer loyalty app to fill your schedule with planned repair work.",Secure Reliable Revenue from Advanced Classes with Tuition Loyalty.,Activate a Referral Bonus: Offer a tuition loyalty bonus for the second year and a referral bonus for new students.,Fill Schedule: Centralize the bonus system in a customer loyalty app to fill your schedule with planned repair work.,"Stop Student Quit: Stop students passionate about ""beginner ballet classes"" from quitting after the recital, securing reliable advanced revenue.","Students quit after the recital, denying us revenue from advanced classes. By activating a referral bonus for repeat repair clients (tuition loyalty bonus) and centralizing the bonus system in a customer loyalty app, we fill our schedule with planned repair work. We've ensured commitment to advanced training.",Maria Diaz,Graceful Steps Dance
Daycare Center,daycare-center,68df026d0133a76106f67e29,68cc952cdf0724cd25ca06a3,68df211951a9fafdea37ca5d,false,false,Fri Oct 03 2025 01:04:25 GMT+0000 (Coordinated Universal Time),Fri Oct 03 2025 01:04:25 GMT+0000 (Coordinated Universal Time),Fri Oct 03 2025 02:42:28 GMT+0000 (Coordinated Universal Time),Daycare App: Ensure Long-Term Enrollment & Family Loyalty,Ensure Long-Term Daycare Enrollment Loyalty for your business for $650/mo.,Increase Enrollment Stability and Secure Sibling/Referral Sign-Ups.,Encourage word-of-mouth for your Daycare Center with Buildify. Your loyalty program from $650 per month.,"Not incentivizing early registration or sibling discounts with a loyalty bonus means parents seeking ""trusted childcare near me"" treat your center as a temporary stop, losing out on guaranteed, years-long enrollment.","Before the first appointment of the week, create a rewards program for bi-weekly bookings. Manage the points and scheduling exclusively through your customer loyalty app to secure dependable recurring revenue.",Guarantee Years-Long Enrollment with Early Registration Incentives.,Create a Rewards Program: Implement a rewards program for bi-weekly bookings and early registration/sibling discounts.,"Secure Dependable Revenue: Manage the points and scheduling exclusively through your customer loyalty app to secure guaranteed, years-long enrollment.","Stop Temporary Stops: Stop parents from treating your center as a temporary stop, losing out on guaranteed, years-long enrollment.","Parents treated our center as a temporary stop, losing years-long enrollment. By creating a rewards program for bi-weekly bookings (sibling/early registration discount) managed exclusively through our customer loyalty app, we secure dependable recurring revenue. We've locked in years of enrollment.",Jessica Lee,Little Scholars Daycare
Dental Office,dental-office,68df026d0133a76106f67e29,68cc952cdf0724cd25ca06a3,68df21197c9a4a25963b64d8,false,false,Fri Oct 03 2025 01:04:25 GMT+0000 (Coordinated Universal Time),Fri Oct 03 2025 01:04:25 GMT+0000 (Coordinated Universal Time),Fri Oct 03 2025 02:42:28 GMT+0000 (Coordinated Universal Time),Dental Office App: Secure High-Value Patient Loyalty & Referrals,Secure High-Value Patient Loyalty for your Dental Office for $650/mo.,Ensure Bi-Annual Checkups and Increase Acceptance of High-Value Treatments.,Turn first-time visitors into loyal patrons at your Dental Office with Buildify. A loyalty app starting at $650/mo.,"Failing to offer a discounted preventative check-up plan for long-term patients means you miss out on predictable, scheduled revenue and risk your patient base drifting to corporate chains.","Before you open for the day, invite clients back for finishing care with a small credit. Manage this incentive directly in a client app to immediately earn trust for future large-scale projects.",Secure Predictable Revenue by Eliminating Risk of Patient Drift.,Incentivize Finishing Care: Invite clients back for preventative check-up plans with a small credit for future services.,Earn Trust for Future: Manage this incentive directly in a client app to immediately earn trust for future large-scale projects.,"Stop Corporate Drift: Stop missing out on predictable, scheduled revenue and eliminate the risk of patient base drifting to corporate chains.","We missed out on predictable revenue and risked patient drift to corporate chains. By inviting clients back for finishing care with a small credit managed directly in a client app, we immediately earn trust for future large-scale projects. Our patient base is now loyal and predictable.",Dr. Lisa Rodriguez,Family Dental Care
Dermatology Clinic,dermatology-clinic,68df026d0133a76106f67e29,68cc952cdf0724cd25ca06a3,68df211a604716017499c3b1,false,false,Fri Oct 03 2025 01:04:26 GMT+0000 (Coordinated Universal Time),Fri Oct 03 2025 01:04:26 GMT+0000 (Coordinated Universal Time),Fri Oct 03 2025 02:42:28 GMT+0000 (Coordinated Universal Time),Dermatology App: Increase Predictable Maintenance Revenue,Increase Predictable Dermatology Maintenance for your business for $650/mo.,Ensure Consistent Follow-Up Appointments for Skin Health and Product Sales.,Grow repeat business at your Dermatology Clinic with Buildify. A loyalty app starting at $650/mo.,"Ignoring the simple step of suggesting annual skin check packages with a loyalty discount means patients with ""acne scars"" or ""eczema"" only call you when flares are urgent, sacrificing easy, dependable maintenance revenue.","Before the first patient arrives, set up automated maintenance credits for inspections. Use your loyalty platform to push reminders, ensuring a steady, full calendar.","Capture Easy, Dependable Maintenance Revenue via Loyalty Discount.",Set Up Automated Credits: Offer a loyalty discount on annual skin check packages and maintenance services.,"Ensure Full Calendar: Use your loyalty platform to push reminders, ensuring a steady, full calendar of planned maintenance.","Stop Flare-Up Reliance: Stop patients from only calling when flares are urgent, capturing easy, dependable maintenance revenue.","Patients only called when flares were urgent, sacrificing easy maintenance revenue. By setting up automated maintenance credits for inspections (annual skin check package) and pushing reminders via our loyalty platform, we ensure a steady, full calendar. We've converted emergencies into dependable maintenance.",Dr. Sophia Chen,Clear Skin Dermatology
Dog Daycare,dog-daycare,68df026d0133a76106f67e29,68cc952cdf0724cd25ca06a3,68df211e3c4ea6cfca04464f,false,false,Fri Oct 03 2025 01:04:30 GMT+0000 (Coordinated Universal Time),Fri Oct 03 2025 01:04:30 GMT+0000 (Coordinated Universal Time),Fri Oct 03 2025 02:42:28 GMT+0000 (Coordinated Universal Time),Dog Daycare App: Secure Predictable Weekday Capacity,Secure Predictable Weekday Dog Daycare Capacity for your business for $650/mo.,Secure Predictable Weekly Capacity and Drive Boarding Bookings.,Build community around your Dog Daycare with Buildify. Launch your loyalty app today for $650/mo.,"Not incentivizing multi-day boarding passes means owners needing ""dog daycare services"" use cheaper pet sitters, leaving your business exposed to the regret of empty weekday capacity.","Before you open for the day, credit scheduled checkups with a discount. Centralize the entire system in a customer loyalty app to ensure planned work replaces emergencies.",Maximize Weekday Capacity by Incentivizing Multi-Day Passes.,Credit Scheduled Checkups: Offer discounted multi-day boarding passes and credit scheduled checkups with a discount.,Ensure Planned Work: Centralize the entire system in a customer loyalty app to ensure planned loyalty replaces empty weekday capacity.,"Stop Cheap Sitters: Stop owners needing ""dog daycare services"" from using cheaper pet sitters, eliminating the regret of empty capacity.","Owners used cheaper pet sitters, leaving us with empty weekday capacity. By crediting scheduled checkups with a discount (multi-day boarding pass) and centralizing the entire system in a customer loyalty app, planned work replaces emergencies. We've secured predictable weekday capacity.",Jessica Lee,Pawsitive Daycare
Driving School,driving-school,68df026d0133a76106f67e29,68cc952cdf0724cd25ca06a3,68df211fa18f55e17f82480d,false,false,Fri Oct 03 2025 01:04:31 GMT+0000 (Coordinated Universal Time),Fri Oct 03 2025 01:04:31 GMT+0000 (Coordinated Universal Time),Fri Oct 03 2025 02:42:28 GMT+0000 (Coordinated Universal Time),Driving School App: Capture Full Family Education Revenue,Capture Full Family Driving Education Revenue for your Driving School for $650/mo.,"Capture Full Family Driver Education Revenue, from Teens to Adults.",Build repeat enrollments at your Driving School with Buildify. A loyalty app starting at $650/mo.,"Without a clear discount on a second course after passing the initial test, customers needing ""teen driver education"" forget your school when the next family member needs lessons.","Over the weekend, add a bonus credit for recurring seasonal details. Track all credits and reminders exclusively via your mobile loyalty portal for high-value repeat visits.",Capture Family Business by Discounting a Second Driving Course.,Add a Bonus Credit: Offer a discount on a second course and a bonus credit for recurring seasonal details.,Track Loyalty: Track all credits and reminders exclusively via your mobile loyalty portal for high-value repeat visits.,"Capture Next Member: Stop customers needing ""teen driver education"" from forgetting your school when the next family member needs lessons.","Customers forgot our school when the next family member needed lessons. By adding a bonus credit for recurring seasonal details (discount on a second course) tracked exclusively via our mobile loyalty portal, we secure high-value repeat visits. We've captured the full family's driving education.",Anna Petrova,Safe Roads Driving School
Dry Cleaning Service,dry-cleaning-service,68df026d0133a76106f67e29,68cc952cdf0724cd25ca06a3,68df211fea24599e1d9771ca,false,false,Fri Oct 03 2025 01:04:31 GMT+0000 (Coordinated Universal Time),Fri Oct 03 2025 01:04:31 GMT+0000 (Coordinated Universal Time),Fri Oct 03 2025 02:42:28 GMT+0000 (Coordinated Universal Time),"Dry Cleaning App: Secure Dependable, High-Volume Weekly Revenue","Secure Dependable, High-Volume Weekly Revenue for your Dry Cleaning Service for $650/mo.",Lock In High-Volume Weekly Revenue from Corporate and Personal Accounts.,Build repeat orders at your Dry Cleaning Service with Buildify. A loyalty app starting at $650/mo.,"Skipping the creation of a dry cleaning rewards card ensures customers needing suit and shirt pressing use competitors offering coupons, losing the dependable, high-volume weekly revenue.","Before the first appointment of the day, credit repeat cleanings with a discount tier. Manage the scheduling and cues directly within a digital loyalty platform to consistently fill slow weeks on the schedule.","Secure Dependable, High-Volume Weekly Dry Cleaning Revenue.",Credit Repeat Cleanings: Offer a dry cleaning rewards card and credit repeat cleanings with a discount tier.,Consistently Fill Schedule: Manage the scheduling and cues directly within a digital loyalty platform to consistently fill slow weeks on the schedule.,Stop Coupon Switch: Stop customers needing suit and shirt pressing from using competitors offering coupons.,"Customers used competitors offering coupons, losing dependable weekly revenue. By crediting repeat cleanings with a discount tier (dry cleaning rewards card) managed within a digital loyalty platform, we consistently fill slow weeks on the schedule. We've secured dependable, high-volume weekly revenue.",Sarah Davies,Express Cleaners
