Property Management Company,property-management-company,68df026d0133a76106f67e29,68cc952cdf0724cd25ca06a3,68df211d52f7b56ef1f161d0,false,false,Fri Oct 03 2025 01:04:29 GMT+0000 (Coordinated Universal Time),Fri Oct 03 2025 01:04:29 GMT+0000 (Coordinated Universal Time),Fri Oct 03 2025 02:42:28 GMT+0000 (Coordinated Universal Time),Property Management App: Secure Vetted Contractors & Quality Work,Secure Vetted Contractors & Quality Repair Work for your business for $650/mo.,"Secure Vetted, Long-Term Contractors and Streamline Tenant Communications.",Encourage word-of-mouth for your Property Management Company with Buildify. Your loyalty program from $650 per month.,"Failing to offer a ""preferred vendor list"" discount to tenants means they use generic contractors, risking poor quality work that damages your reputation for competent property oversight.","Before the first appointment of the day, credit repeat cleanings with a discount tier. Manage the scheduling and cues directly within a digital loyalty platform to consistently fill slow weeks on the schedule.",Protect Reputation by Empowering Tenants with Preferred Vendor Discounts.,"Credit Repeat Cleanings: Offer a ""preferred vendor list"" discount to tenants and credit repeat cleanings with a discount tier.",Consistently Fill Schedule: Manage the scheduling and cues directly within a digital loyalty platform to consistently fill slow weeks on the schedule.,"Stop Generic Contractors: Stop tenants from using generic contractors, protecting your reputation for competent property oversight.","Tenants used generic contractors, risking poor quality work that damaged our reputation. By crediting repeat cleanings with a discount tier (preferred vendor list discount) managed within a digital loyalty platform, we consistently fill slow weeks on the schedule. We've secured quality, vetted contractors.",Mike O'Connell,Elite Property Management
Pub,pub,68df026d0133a76106f67e29,68cc952cdf0724cd25ca06a3,68df21187247623dc903df7b,false,false,Fri Oct 03 2025 01:04:24 GMT+0000 (Coordinated Universal Time),Fri Oct 03 2025 01:04:24 GMT+0000 (Coordinated Universal Time),Fri Oct 03 2025 02:42:28 GMT+0000 (Coordinated Universal Time),"Pub Loyalty App: Retain Your Loyal, High-Value Patrons",Keep Your Loyal Patrons from Switching Pubs for $650/mo.,Ensure Patrons Choose Your Pub for Weekly Events and Sporting Viewings.,Encourage word-of-mouth for your Pub with Buildify. Your loyalty program from $650 per month.,"Failing to offer a preferred table reservation or weekly special reward means your most loyal pub regulars feel undervalued, guaranteeing they'll try any competitor offering better perks.","By 8 am Monday, set priority scheduling credits for annual pruning. Control this reliable schedule directly through a client management app to keep your high-value crews moving efficiently.",Guarantee Loyalty by Recognizing and Rewarding Pub Regulars.,Set Priority Scheduling: Offer preferred table reservations and a weekly special reward for dedicated regulars.,Eliminate Undervalued Feeling: Control this reliable schedule directly through a client management app to ensure loyalty is recognized.,Stop Competitor Perks: Guarantee regulars avoid competitors by ensuring they receive better perks at your pub.,"Our most loyal pub regulars felt undervalued and tried competitors. By setting priority scheduling credits for annual pruning (preferred tables) controlled directly through a client management app, we keep our high-value crews moving efficiently. Our regulars know they are our top priority now.",Liam O'Malley,The Griffin Pub
RV Repair Service,rv-repair-service,68df026d0133a76106f67e29,68cc952cdf0724cd25ca06a3,68df211c33c6a556c100b0b8,false,false,Fri Oct 03 2025 01:04:28 GMT+0000 (Coordinated Universal Time),Fri Oct 03 2025 01:04:28 GMT+0000 (Coordinated Universal Time),Fri Oct 03 2025 02:42:28 GMT+0000 (Coordinated Universal Time),"RV Repair App: Capture Continuous, Specialized Service Work","Capture Continuous, Specialized RV Service Work for your business for $650/mo.",Capture All Seasonal Maintenance and Upgrade Projects from Loyal Owners.,Build community around your RV Repair Service with Buildify. Launch your loyalty app today for $650/mo.,"Skipping the creation of a ""winterization loyalty discount"" ensures owners needing ""RV roof repair"" use general mechanics, missing the chance to capture continuous, specialized service work.","Before the first appointment of the week, create a rewards program for bi-weekly bookings. Manage the points and scheduling exclusively through your customer loyalty app to secure dependable recurring revenue.","Capture Continuous, Specialized Service Work with Loyalty Discounts.","Create a Rewards Program: Offer a ""winterization loyalty discount"" for RV owners.",Secure Dependable Revenue: Manage the points and scheduling exclusively through your customer loyalty app to secure dependable recurring revenue.,"Stop General Mechanics: Stop owners needing ""RV roof repair"" from using general mechanics, capturing continuous, specialized service work.","Owners used general mechanics, missing specialized service work. By creating a rewards program for bi-weekly bookings (winterization loyalty discount) managed exclusively through our customer loyalty app, we secure dependable recurring revenue. We've captured continuous, specialized service work.",Gary Hughes,Trail Blazer RV Repair
Real Estate Agency,real-estate-agency,68df026d0133a76106f67e29,68cc952cdf0724cd25ca06a3,68df211d8606f53755d6cf47,false,false,Fri Oct 03 2025 01:04:29 GMT+0000 (Coordinated Universal Time),Fri Oct 03 2025 01:04:29 GMT+0000 (Coordinated Universal Time),Fri Oct 03 2025 02:42:28 GMT+0000 (Coordinated Universal Time),Real Estate App: Turn Past Clients into Top Lead Generators,Turn Past Clients into Top Lead Generators for your Real Estate Agency for $650/mo.,"Turn Past Clients into a Stable Source of High-Quality, Exclusive Referrals.",Build community around your Real Estate Agency with Buildify. Get started for $650 per month.,"When you don't offer a referral incentive for closing deals, past clients seeking ""first-time home buying advice"" never send their friends, missing out on easy, organic lead generation.","Before you open for the day, credit scheduled checkups with a discount. Centralize the entire system in a customer loyalty app to ensure planned work replaces emergencies.","Generate Easy, Organic Leads by Rewarding Past Client Referrals.",Credit Scheduled Checkups: Offer a referral incentive for closing deals and credit scheduled checkups with a discount.,Ensure Planned Work: Centralize the entire system in a customer loyalty app to ensure planned loyalty replaces emergencies.,"Organic Lead Gen: Stop past clients from never sending their friends, missing out on easy, organic lead generation.","Past clients never sent their friends, missing out on organic lead generation. By crediting scheduled checkups with a discount (referral incentive) and centralizing the entire system in a customer loyalty app, planned work replaces emergencies. Our past clients are now our best source of leads.",Jessica Lee,Pinnacle Realty
Record Store,record-store,68df026d0133a76106f67e29,68cc952cdf0724cd25ca06a3,68df211b70aa7af7046c6ddf,false,false,Fri Oct 03 2025 01:04:27 GMT+0000 (Coordinated Universal Time),Fri Oct 03 2025 01:04:27 GMT+0000 (Coordinated Universal Time),Fri Oct 03 2025 02:42:28 GMT+0000 (Coordinated Universal Time),"Record Store App: Secure High-Value, Repeat Vinyl Sales","Secure High-Value, Repeat Vinyl Sales for your Record Store for $650/mo.",Monetize Loyalty by Driving Repeat Vinyl Purchases and Exclusive Releases.,Build community around your Record Store with Buildify. Get started for $650 per month.,"Failing to offer a multi-album purchase discount means music fans looking for ""rare vinyl records"" use online marketplaces, robbing your store of consistent, high-value, collectible transactions.","Before the first class starts, reward recurring safety checks with a discount tier. Schedule redemptions directly through your mobile loyalty platform, keeping your advanced service top of mind.","Capture High-Value, Consistent Collectible Transactions.","Reward Recurring Safety Checks: Offer a multi-album purchase discount for fans looking for ""rare vinyl records.""","Advanced Service: Schedule redemptions directly through your mobile loyalty platform, keeping your advanced service top of mind.","Stop Online Marketplaces: Stop music fans from using online marketplaces, capturing consistent, high-value, collectible transactions.","Music fans used online marketplaces, robbing us of high-value transactions. By rewarding recurring safety checks with a discount tier (multi-album purchase discount) scheduled directly through our mobile loyalty platform, we keep our advanced service top of mind. We've captured consistent, high-value collectible sales.",Marcus Bell,Vinyl Revival Records
Restaurant,restaurant,68df026d0133a76106f67e29,68cc952cdf0724cd25ca06a3,68df211679af3045a8eeb2c9,false,false,Fri Oct 03 2025 01:04:22 GMT+0000 (Coordinated Universal Time),Fri Oct 03 2025 01:04:22 GMT+0000 (Coordinated Universal Time),Fri Oct 03 2025 02:42:28 GMT+0000 (Coordinated Universal Time),Boost Direct Orders: Restaurant Loyalty App & Rewards Program,Boost Direct Orders & Diner Loyalty for your Restaurant for $650/mo.,Increase Direct Order Revenue by 40% and Bypass Expensive Third-Party Fees.,Turn first-time visitors into loyal patrons at your Restaurant with Buildify. Your loyalty program from $650 per month.,"Without an easy-to-use digital rewards program, customers forget their last visit and have no incentive to choose your restaurant over the new spot opening up down the street.","Before week’s start, offer points for return visits and an automated add-on perk. Track perks and progress on a digital loyalty app to ensure predictable traffic replaces one-off diners.","Replace One-Off Diners with Predictable, High-Frequency Traffic.",Incentivize Return Visits: Offer points for return visits and an automated add-on perk to secure loyalty.,Eliminate Choice Paralysis: Track perks and progress on a digital loyalty app to ensure your restaurant is the automatic choice.,Boost Predictable Traffic: Ensure predictable foot traffic replaces one-off diners by providing a clear incentive.,"Our diners were only using third-party apps, killing our margins. By implementing the loyalty app with tiered credits for app-based ordering, we boosted direct, high-margin take-out sales. Our profits are finally back where they should be.",Chef Tony Moretti,The Grotto
Retail Store,retail-store,68df026d0133a76106f67e29,68cc952cdf0724cd25ca06a3,68df211aef5e77653846cb7d,false,false,Fri Oct 03 2025 01:04:26 GMT+0000 (Coordinated Universal Time),Fri Oct 03 2025 01:04:26 GMT+0000 (Coordinated Universal Time),Fri Oct 03 2025 02:42:28 GMT+0000 (Coordinated Universal Time),Retail Loyalty App: Build a Dedicated Shopper Following,"Build a Dedicated, Loyal Shopper Following for your Retail Store for $650/mo.",Boost AOV and Increase Foot Traffic with Personalized Discounts and Rewards.,Build community around your Retail Store with Buildify. Your loyalty program from $650 per month.,"When you don't offer a loyalty points system for consistent purchases, shoppers needing ""everyday household goods"" use big-box stores, sacrificing the reliable revenue from community patrons.","Over the weekend, invite clients back for finishing care with a small credit. Manage this incentive directly in a client app to immediately earn trust for future large-scale projects.",Capture Reliable Revenue from Community Patrons with a Points System.,Invite Clients Back: Offer a loyalty points system for consistent purchases and finishing care with a small credit.,Earn Trust for Future: Manage this incentive directly in a client app to immediately earn trust for future large-scale projects.,"Stop Big-Box Use: Stop shoppers needing ""everyday household goods"" from defaulting to big-box stores.","Shoppers used big-box stores, sacrificing the reliable revenue from community patrons. By inviting clients back for finishing care with a small credit (loyalty points) managed directly in a client app, we immediately earn trust for future large-scale projects. Our community patrons are now loyal.",David Wilson,Main Street Goods
Roofing Company,roofing-company,68df026d0133a76106f67e29,68cc952cdf0724cd25ca06a3,68df2114972a4dc771a164f6,false,false,Fri Oct 03 2025 01:04:20 GMT+0000 (Coordinated Universal Time),Fri Oct 03 2025 01:04:20 GMT+0000 (Coordinated Universal Time),Fri Oct 03 2025 02:42:28 GMT+0000 (Coordinated Universal Time),Roofing Loyalty App: Secure Proactive Maintenance Contracts,Convert Estimates to Loyal Clients for your Roofing Company for $650/mo.,Convert One-Time Estimates into Loyal Clients with a Proactive Referral System.,Build community around your Roofing Company with Buildify. Loyalty made simple at $650/mo.,"Roof projects close well, but routine inspections go dark; without seasonal cues, customers worry about leaks and search for a contractor who stays in touch.","By early Monday, implement tiered credits for annual inspections and minor fixes, then automate a six-month check-in to ensure consistent care turns one roof into predictable repeat work.","Turn Single Projects into Predictable, Consistent Repeat Business.",Forecast Future Work: Implement tiered credits for annual inspections and minor fixes to ensure consistent care.,Reduce Leak Anxiety: Automate a six-month check-in to proactively address customer worries about leaks.,Build Long-Term Loyalty: Stop customers from searching for a contractor who stays in touch by beating them to the punch.,"We needed a better way to secure high-margin seasonal work. When we added loyalty points for semi-annual cleans and house them in the client app, we saw a 40% jump in return appointments. We can now proactively win those crucial return appointments instead of chasing leads.",Robert Vance,Apex Roofing & Gutters
Salon,salon,68df026d0133a76106f67e29,68cc952cdf0724cd25ca06a3,68df211810d20c9297543eb7,false,false,Fri Oct 03 2025 01:04:24 GMT+0000 (Coordinated Universal Time),Fri Oct 03 2025 01:04:24 GMT+0000 (Coordinated Universal Time),Fri Oct 03 2025 02:42:28 GMT+0000 (Coordinated Universal Time),Salon App: Capture Full Retail & Service Client Revenue,Capture Full Retail & Service Revenue for your Salon for $650/mo.,Guarantee Rebooking of Appointments and Increase Spend on Retail Products.,Turn first-time visitors into loyal patrons at your Salon with Buildify. A loyalty app starting at $650/mo.,Failing to incentivize product purchases or offer a seasonal service bundle to loyal clients means they quietly shop online or at other salons for their essentials.,"Over the weekend, reward recurring visits with a free treatment after a few sessions. Manage this system via a client rewards portal, keeping your high-value customers committed.",Stop Clients From Shopping Online by Rewarding Product Loyalty.,Reward Recurring Visits: Offer a free treatment or service bundle after a few sessions to incentivize product purchases.,"Keep Customers Committed: Manage this system via a client rewards portal, keeping your high-value customers committed to your salon.",Capture Retail Sales: Stop clients from quietly shopping online or at other salons for their essentials.,"Loyal clients quietly shopped online for their essentials. By rewarding recurring visits with a free treatment after a few sessions managed via a client rewards portal, we keep our high-value customers committed. We've secured all their retail and service spend.",Michael Vance,Stylehaus Salon
Sandwich Shop,sandwich-shop,68df026d0133a76106f67e29,68cc952cdf0724cd25ca06a3,68df21183bf9429e7642ba01,false,false,Fri Oct 03 2025 01:04:24 GMT+0000 (Coordinated Universal Time),Fri Oct 03 2025 01:04:24 GMT+0000 (Coordinated Universal Time),Fri Oct 03 2025 02:42:28 GMT+0000 (Coordinated Universal Time),Sandwich Shop App: Drive Predictable Daily Traffic & Orders,Drive Predictable Daily Sandwich Shop Traffic for your business for $650/mo.,Generate Predictable High-Volume Corporate Lunch Orders and Group Meals.,Keep loyal customers coming back to your Sandwich Shop with Buildify. Launch your loyalty app today for $650/mo.,"Not incentivizing app-based pre-orders with a loyalty bonus means clients only use your sandwich shop when convenient, losing out on the easy, dependable daily traffic that builds steady profits.","Before your doors open, credit scheduled checkups with a discount. Centralize the entire system in a customer loyalty app to ensure planned work replaces emergencies.","Capture Easy, Dependable Daily Traffic with Loyalty Bonuses.",Credit Scheduled Checkups: Offer a loyalty bonus and credits for app-based pre-orders.,Eliminate Convenience-Only Visits: Centralize the entire system in a customer loyalty app to guarantee dependable daily traffic.,"Build Steady Profits: Ensure planned work replaces emergencies, capturing easy, dependable daily traffic that builds steady profits.","Clients only used us when convenient, not as a dependable daily traffic source. By crediting scheduled checkups with a discount (app pre-order bonus) and centralizing the system in a customer loyalty app, we ensure planned work replaces emergencies. We've secured the easy, dependable daily traffic we needed.",Mike Sullivan,The Corner Deli
Scooter Rental,scooter-rental,68df026d0133a76106f67e29,68cc952cdf0724cd25ca06a3,68df211d3bf9429e7642ba46,false,false,Fri Oct 03 2025 01:04:29 GMT+0000 (Coordinated Universal Time),Fri Oct 03 2025 01:04:29 GMT+0000 (Coordinated Universal Time),Fri Oct 03 2025 02:42:28 GMT+0000 (Coordinated Universal Time),Scooter Rental App: Increase Predictable Rental Value,Increase Predictable Scooter Rental Value for your business for $650/mo.,Increase Predictable Daily Rental Volume by Rewarding Frequent Users.,Build community around your Scooter Rental with Buildify. Your loyalty program from $650 per month.,"Failing to offer a multi-day rental package means riders needing ""scooter hire"" shop around daily, leading to the regret of a low, unpredictable average transaction value.","Over the weekend, activate a referral bonus for repeat repair clients. Centralize the bonus system in a customer loyalty app to fill your schedule with planned repair work.",Stop Daily Shopping Around with a Multi-Day Rental Package.,Activate a Referral Bonus: Offer a multi-day rental package and a referral bonus for repeat repair clients.,Fill Schedule: Centralize the bonus system in a customer loyalty app to fill your schedule with planned repair work.,"Stop Low Value: Stop riders needing ""scooter hire"" from shopping around daily, eliminating a low, unpredictable average transaction value.","Riders shopped around daily, leading to low, unpredictable transaction value. By activating a referral bonus for repeat repair clients (multi-day rental package) and centralizing the bonus system in a customer loyalty app, we fill our schedule with planned repair work. We've secured a higher, predictable average transaction value.",Ethan King,Urban Scooter Hire
Seafood Restaurant,seafood-restaurant,68df026d0133a76106f67e29,68cc952cdf0724cd25ca06a3,68df2117e770f7da328b8571,false,false,Fri Oct 03 2025 01:04:23 GMT+0000 (Coordinated Universal Time),Fri Oct 03 2025 01:04:23 GMT+0000 (Coordinated Universal Time),Fri Oct 03 2025 02:42:28 GMT+0000 (Coordinated Universal Time),Seafood App: Ensure Repeat Bookings & Diner Loyalty,Ensure Repeat Seafood Restaurant Bookings & Loyalty for your business for $650/mo.,Drive Off-Season Traffic and Secure Repeat Table Bookings with Exclusive Perks.,Turn first-time visitors into loyal patrons at your Seafood Restaurant with Buildify. A loyalty app starting at $650/mo.,"When you don't offer a seafood club membership with priority reservations or specials, customers feel no commitment to your brand, causing them to explore any new waterfront restaurant opening nearby.","Before the week begins, reward recurring patrons with priority seating credits. Manage this incentive directly in a client app to immediately earn trust for future large dining parties.",Earn Trust for Future Large Dining Parties with Priority Access.,"Reward Recurring Patrons: Offer priority seating credits and specials to dedicated, repeat patrons.",Build Brand Commitment: Manage this incentive directly in a client app to immediately build commitment and loyalty to your brand.,Stop Competitive Exploration: Prevent customers from exploring new waterfront restaurants by recognizing and rewarding their loyalty.,"Seafood RestaurantCustomers felt no commitment and explored new waterfront restaurants. By rewarding recurring patrons with priority seating credits managed directly in a client app, we immediately earn trust for future large dining parties. We've built a strong, exclusive seafood club.",Captain Jack Smith,Anchor Bay Seafood
Security & Alarm Company,security-alarm-company,68df026d0133a76106f67e29,68cc952cdf0724cd25ca06a3,68df211d7edcf0e5baeededc,false,false,Fri Oct 03 2025 01:04:29 GMT+0000 (Coordinated Universal Time),Fri Oct 03 2025 01:04:29 GMT+0000 (Coordinated Universal Time),Fri Oct 03 2025 02:42:28 GMT+0000 (Coordinated Universal Time),"Security App: Ensure Stable, Recurring Monitoring Revenue","Ensure Stable, Recurring Alarm Monitoring Revenue for your company for $650/mo.",Guarantee Annual Monitoring Contracts and Secure System Upgrade Revenue.,Keep loyal customers coming back to your Security & Alarm Company with Buildify. Loyalty made simple at $650/mo.,"Not incentivizing alarm monitoring renewals with a discount means clients seeking ""residential security systems"" easily switch providers when a competitor offers a slightly lower annual fee.","Before the first appointment of the week, set up automated maintenance credits for existing clients. Use your loyalty platform to push reminders, ensuring stable, recurring monitoring revenue.",Ensure Stable Recurring Revenue by Rewarding Monitoring Renewals.,Automate Maintenance Credits: Offer discounted alarm monitoring renewals to ensure consistent service subscription.,"Secure Stable Revenue: Use your loyalty platform to push reminders, securing stable, recurring monitoring revenue.",Stop Competitor Switch: Stop clients from switching providers when a competitor offers a slightly lower annual fee.,"Clients easily switched providers when a competitor offered a slightly lower annual fee. By setting up automated maintenance credits for existing clients and pushing reminders via our loyalty platform, we ensure stable, recurring monitoring revenue. We've secured their long-term security contract.",Ben Carter,Guardian Alarm Systems
Senior Care Service,senior-care-service,68df026d0133a76106f67e29,68cc952cdf0724cd25ca06a3,68df21194368c9a4903d87ef,false,false,Fri Oct 03 2025 01:04:25 GMT+0000 (Coordinated Universal Time),Fri Oct 03 2025 01:04:25 GMT+0000 (Coordinated Universal Time),Fri Oct 03 2025 02:42:28 GMT+0000 (Coordinated Universal Time),Senior Care App: Secure Long-Term Service Contracts,Secure Long-Term Senior Care Contracts for your service for $650/mo.,"Secure Stable, Long-Term Contracts with Automated Communication and Trust.",Grow repeat business at your Senior Care Service with Buildify. Your loyalty program from $650 per month.,"Ignoring the chance to offer a caregiver rewards program for long-term clients means families needing ""dementia care assistance"" switch agencies whenever a slightly cheaper option appears.","Before the first patient arrives, add loyalty points for semi-annual cleans. House the proactive plan within a customer loyalty app to proactively win the crucial return appointment.",Secure Long-Term Enrollment by Rewarding Caregiver Loyalty.,Add Loyalty Points: Implement loyalty points for semi-annual cleans and a caregiver rewards program for long-term clients.,Win Long-Term Enrollment: House the proactive plan within a customer loyalty app to proactively win the crucial return enrollment.,"Stop Switching Agencies: Stop families needing ""dementia care assistance"" from switching agencies when a slightly cheaper option appears.","Families switched agencies whenever a slightly cheaper option appeared. By adding loyalty points for semi-annual cleans (caregiver rewards) and housing the proactive plan within a customer loyalty app, we proactively win the crucial return appointment. We've built an exclusive, loyal client base.",Sarah Evans,Compassionate Senior Care
