Industry,Slug,Collection ID,Locale ID,Item ID,Archived,Draft,Created On,Updated On,Published On,SEO Title,H1 Title,H2 Supporting,Meta Description,H2 Problem,H2 Solution,H3 Unique Value Prop,Benefit 1,Benefit 2,Benefit 3,Testimonial,Testimonial Credit Name,Testimonial Credit Place
Accounting Firm,accounting-firm,68df026d0133a76106f67e29,68cc952cdf0724cd25ca06a3,68df211d5b2f2315e795acec,false,false,Fri Oct 03 2025 01:04:29 GMT+0000 (Coordinated Universal Time),Fri Oct 03 2025 01:04:29 GMT+0000 (Coordinated Universal Time),Fri Oct 03 2025 02:42:28 GMT+0000 (Coordinated Universal Time),"Accounting App: Lock In Stable, Recurring Revenue","Lock In Stable, Recurring Accounting Revenue for your firm for $650/mo.",Lock In Long-Term Annual Tax and Quarterly Bookkeeping Contracts.,Turn first-time visitors into loyal patrons at your Accounting Firm with Buildify. Your loyalty program from $650 per month.,"Without a clear discount for long-term retainer agreements, businesses seeking ""small business tax preparation"" hop between firms annually, robbing your firm of stable recurring revenue.","Over the weekend, add a bonus credit for recurring seasonal details. Track all credits and reminders exclusively via your mobile loyalty portal for high-value repeat visits.","Secure Stable, Recurring Revenue with Long-Term Retainer Discounts.",Add a Bonus Credit: Offer a clear discount for long-term retainer agreements and a bonus credit for recurring seasonal details.,Track Loyalty: Track all credits and reminders exclusively via your mobile loyalty portal for high-value repeat visits.,"Stop Firm Hopping: Stop businesses seeking ""small business tax preparation"" from hopping between firms annually.","Businesses hopped between firms annually, robbing us of stable recurring revenue. By adding a bonus credit for recurring seasonal details (long-term retainer discount) tracked exclusively via our mobile loyalty portal, we secure high-value repeat visits. We've secured stable, recurring revenue.",David Chen,Summit Accounting
Acupuncture Clinic,acupuncture-clinic,68df026d0133a76106f67e29,68cc952cdf0724cd25ca06a3,68df21192166755b749e660a,false,false,Fri Oct 03 2025 01:04:25 GMT+0000 (Coordinated Universal Time),Fri Oct 03 2025 01:04:25 GMT+0000 (Coordinated Universal Time),Fri Oct 03 2025 02:42:28 GMT+0000 (Coordinated Universal Time),Acupuncture App: Lock In Long-Term Treatment Plans,Lock In Long-Term Acupuncture Treatment Plans for your business for $650/mo.,Secure Long-Term Wellness Packages and Reduce Patient Drop-Off Rates.,Grow repeat business at your Acupuncture Clinic with Buildify. Get started for $650 per month.,"Failing to offer a discounted bundle for maintenance sessions means patients seeking ""chronic joint pain relief"" stop treatments prematurely, leading to relapse and the loss of your steady income.","Over the weekend, credit repeat cleanings with a discount tier. Manage the scheduling and cues directly within a digital loyalty platform to consistently fill slow weeks on the schedule.",Secure Steady Income by Rewarding Maintenance Session Bundles.,"Credit Repeat Cleanings: Offer a discounted bundle for maintenance sessions to secure steady, reliable income.",Prevent Treatment Relapse: Manage the scheduling and cues directly within a digital loyalty platform to ensure patients don't stop treatments prematurely.,"Full Value of Care: Stop the loss of steady income by rewarding patients seeking ""chronic joint pain relief.""","Patients stopped treatments prematurely, leading to relapse and loss of steady income. By crediting repeat cleanings with a discount tier (maintenance bundle) managed within a digital loyalty platform, we consistently fill slow weeks on the schedule. We've secured the long-term income from chronic pain relief.",Jia Li,Tranquil Point Acupuncture
After-School Program,after-school-program,68df026d0133a76106f67e29,68cc952cdf0724cd25ca06a3,68df2119b64e5028fdc71729,false,false,Fri Oct 03 2025 01:04:25 GMT+0000 (Coordinated Universal Time),Fri Oct 03 2025 01:04:25 GMT+0000 (Coordinated Universal Time),Fri Oct 03 2025 02:42:28 GMT+0000 (Coordinated Universal Time),After-School App: Boost Student Engagement & Attendance,Boost Student Engagement & Program Attendance for your After-School Program for $650/mo.,Boost Enrollment and Ensure Attendance for Advanced or Specialized Classes.,Keep loyal parents coming back to your After-School Program with Buildify. A loyalty app starting at $650/mo.,"When you don't offer a monthly activity pass reward for consistent attendance, children in your ""after school enrichment"" program lose interest, leading to the regret of unpredictable attendance and payments.","Over the weekend, implement tiered credits for post-treatment checkups. Automate follow-ups and tracking through a branded rewards app to secure predictable, high-margin resolution work.",Secure Predictable Attendance and Payments with Monthly Activity Passes.,Implement Tiered Credits: Offer tiered credits for monthly activity pass rewards and consistent attendance.,"Build Interest: Automate follow-ups and tracking through a branded rewards app to ensure children in ""after school enrichment"" programs maintain interest.",Predictable Payments: Stop the regret of unpredictable attendance and payments by rewarding consistent participation.,"Children lost interest, leading to unpredictable attendance and payments. By implementing tiered credits for post-treatment checkups (monthly activity pass) and automating follow-ups through a branded rewards app, we secure predictable, high-margin resolution work. We've boosted engagement and stabilized revenue.",Chloe Green,Zenith Enrichment Center
Animal Shelter,animal-shelter,68df026d0133a76106f67e29,68cc952cdf0724cd25ca06a3,68df211eafb4a1281550bfb6,false,false,Fri Oct 03 2025 01:04:30 GMT+0000 (Coordinated Universal Time),Fri Oct 03 2025 01:04:30 GMT+0000 (Coordinated Universal Time),Fri Oct 03 2025 02:42:28 GMT+0000 (Coordinated Universal Time),"Shelter App: Drive Reliable, Organic Pet Adoptions","Drive Reliable, Organic Pet Adoptions for your Animal Shelter for $650/mo.",Drive Reliable Adoptions and Secure Ongoing Donations from the Community.,Encourage word-of-mouth for your Animal Shelter with Buildify. Your loyalty program from $650 per month.,"When you don't reward volunteers with a referral bonus for adoptions, families seeking ""local dog rescues"" choose the shelter with the flashiest social media campaign instead of your trusted organization.","Before your employees clock in for the day, set priority scheduling credits for annual inspections. Control this reliable schedule directly through a client management app to keep your high-value crews moving efficiently.",Leverage Volunteers to Drive Adoptions for Your Trusted Organization.,Set Priority Scheduling: Offer a referral bonus for adoptions to volunteers and priority scheduling for annual inspections.,Control Client Flow: Control this reliable schedule directly through a client management app to ensure families choose your trusted organization.,"Stop Flashy Media: Stop families seeking ""local dog rescues"" from choosing the shelter with the flashiest social media campaign.","Families chose the shelter with the flashiest social media campaign instead of our trusted organization. By setting priority scheduling credits for annual inspections (volunteer referral bonus) controlled directly through a client management app, we keep our high-value crews moving efficiently. We've secured reliable, organic adoptions.",Tony Rossi,Second Chance Shelter
Appliance Repair Service,appliance-repair-service,68df026d0133a76106f67e29,68cc952cdf0724cd25ca06a3,68df21158a653e2f1f6be827,false,false,Fri Oct 03 2025 01:04:21 GMT+0000 (Coordinated Universal Time),Fri Oct 03 2025 01:04:21 GMT+0000 (Coordinated Universal Time),Fri Oct 03 2025 02:42:28 GMT+0000 (Coordinated Universal Time),Appliance Repair App: Capture All Repeat & Referral Revenue,Capture All Repeat Appliance Repair Revenue for your business for $650/mo.,Secure All Future Repair Needs with Instant Service Reminders and Priority Status.,Build community around your Appliance Repair Service with Buildify. Your loyalty program from $650 per month.,"Not offering a discounted follow-up check after the initial repair creates silent dissatisfaction, guaranteeing those customers won't call you for their next inevitable breakdown and easy referral.","Before your routes begin, reward repeat service calls with a flat-rate discount. Deploy this easy system through a client service app to stabilize route income and reduce unexpected downtime.",Stabilize Route Income and Secure Easy Follow-Up Referrals.,Reward Repeat Service Calls: Offer a flat-rate discount toward a follow-up check after the initial repair.,Eliminate Silent Dissatisfaction: Deploy this easy system through a client service app to address customer concerns proactively.,Guarantee Future Business: Ensure those customers call you for their next inevitable breakdown and easy referral.,"Customers always shopped around for parts after the initial diagnosis. By implementing automatic credits for annual health checks and pushing points updates via a client rewards portal, we've kept all parts and labor revenue in-house. Our financial health is now sound and predictable.",Brenda Scott,Home Appliance Heroes
Auto Body Shop,auto-body-shop,68df026d0133a76106f67e29,68cc952cdf0724cd25ca06a3,68df2114cf848ffd8c532c39,false,false,Fri Oct 03 2025 01:04:20 GMT+0000 (Coordinated Universal Time),Fri Oct 03 2025 01:04:20 GMT+0000 (Coordinated Universal Time),Fri Oct 03 2025 02:42:28 GMT+0000 (Coordinated Universal Time),Auto Body Loyalty App: Drive Repeat & High-Value Referral Business,Drive Repeat & Referral Business for your Auto Body Shop for $650/mo.,Generate High-Quality Referrals from Past Clients to Fuel Sustainable Growth.,Grow repeat business at your Auto Body Shop with Buildify. Your loyalty program from $650 per month.,"Collision repair restores structure, then surface care is forgotten; if not reminded, clients skip protection upgrades and schedule work elsewhere.","By Monday morning, invite clients back for finish care and touch-ups, with a small credit on return, ensuring this care after the repair earns future business and long-term trust.",Earn Future Business and Long-Term Trust After Collision Repair.,Incentivize Finish Care: Invite clients back for surface care and touch-ups with a small credit on their return.,Secure Protection Upgrades: Ensure clients don't skip crucial protection upgrades by providing an easy follow-up path.,Earn Future Trust: Ensure care after the repair earns future high-value body work and long-term loyalty.,"We rarely saw repeat business after a major repair. Now, we invite clients back for finishing care with a small credit for future services managed directly in the client app, which immediately earns trust for their family's future bodywork. The word-of-mouth referrals have been amazing.",Anna Petrova,Elite Collision Center
Auto Detailing Service,auto-detailing-service,68df026d0133a76106f67e29,68cc952cdf0724cd25ca06a3,68df2114c0a9360c09b96b67,false,false,Fri Oct 03 2025 01:04:20 GMT+0000 (Coordinated Universal Time),Fri Oct 03 2025 01:04:20 GMT+0000 (Coordinated Universal Time),Fri Oct 03 2025 02:42:28 GMT+0000 (Coordinated Universal Time),Auto Detailing Loyalty App: Secure High-Margin Service Loyalty,Secure High-Margin Detailing Service Loyalty for your Auto Detailing Service for $650/mo.,Drive Repeat Business by Scheduling Next-Day Appointments and Exclusive Loyalty Tiers.,Keep loyal customers coming back to your Auto Detailing Service with Buildify. Loyalty made simple at $650/mo.,"Detailing reveals beauty, but dirt returns fast; without a suggested refresh schedule, clients skip appointments and your shop drifts from mind.","Before the week begins, add a bonus credit for recurring details and set a polite reminder near the due date, ensuring clean cars and clear prompts bring repeat, high-value visits.","Guarantee Repeat, High-Value Detailing Visits with Clear Prompts.","Incentivize Recurring Details: Add a bonus credit for clients to return, ensuring your shop stays top-of-mind.",Maintain Shop Recall: Set a polite reminder near the due date to prevent your shop from drifting from client memory.,"High-Value Visits: Ensure clear, proactive prompts drive high-frequency, high-margin appointments.","My biggest pain point was securing predictable, high-margin product sales. Since we implemented tiered credits for package upgrades and retail purchases and automate tracking through our branded rewards app, our average transaction value has skyrocketed. Now the retail shelf pulls its own weight.",Derek Jones,Precision Detail
Auto Glass Repair,auto-glass-repair,68df026d0133a76106f67e29,68cc952cdf0724cd25ca06a3,68df211cb4b83cd45155809b,false,false,Fri Oct 03 2025 01:04:28 GMT+0000 (Coordinated Universal Time),Fri Oct 03 2025 01:04:28 GMT+0000 (Coordinated Universal Time),Fri Oct 03 2025 02:42:28 GMT+0000 (Coordinated Universal Time),Auto Glass App: Increase Referrals & Repeat Work,Increase Referrals & Repeat Auto Glass Work for your business for $650/mo.,"Generate High-Volume, Reliable Referrals from Insurance and Body Shops.",Encourage word-of-mouth for your Auto Glass Repair with Buildify. Your loyalty program from $650 per month.,"Failing to offer a discounted second repair means drivers needing ""windshield replacement"" only use your shop once, sacrificing the easy referral and family business opportunities.","Before your employees clock in for the day, set priority scheduling credits for annual inspections. Control this reliable schedule directly through a client management app to keep your high-value crews moving efficiently.",Capture Easy Referral and Family Business with Loyalty Discounts.,Set Priority Scheduling: Offer a discounted second repair and priority scheduling for annual inspections.,Control Client Flow: Control this reliable schedule directly through a client management app to ensure you capture easy referral and family business.,"Stop One-Time Use: Stop drivers needing ""windshield replacement"" from only using your shop once.","Drivers only used our shop once, sacrificing referral and family business. By setting priority scheduling credits for annual inspections (discounted second repair) controlled directly through a client management app, we keep our high-value crews moving efficiently. We've captured the easy referral business.",Anna Petrova,Clear View Auto Glass
Auto Repair Shop,auto-repair-shop,68df026d0133a76106f67e29,68cc952cdf0724cd25ca06a3,68df21142f45914f7493c0c0,false,false,Fri Oct 03 2025 01:04:20 GMT+0000 (Coordinated Universal Time),Fri Oct 03 2025 01:04:20 GMT+0000 (Coordinated Universal Time),Fri Oct 03 2025 02:42:28 GMT+0000 (Coordinated Universal Time),Auto Repair App: Increase Scheduled Maintenance & Customer Trust,Increase Scheduled Auto Maintenance Revenue for your Auto Repair Shop for $650/mo.,Improve Customer Trust and Ensure Compliance with Scheduled Maintenance Reminders.,Build community around your Auto Repair Shop with Buildify. Loyalty made simple at $650/mo.,"Auto repair silences alarms, but system upkeep is neglected; without a plan, clients fret over future breakdowns and seek garages more proactive.","Before your doors open, credit scheduled checkups with a discount and send quick, pre-emptive reminders, filling service bays with planned work instead of relying on emergencies.",Fill Service Bays with Planned Work Instead of Costly Emergencies.,Credit Scheduled Checkups: Offer a discount for scheduled preventive checkups instead of relying on breakdowns.,"Proactive Client Care: Send quick, pre-emptive reminders so clients avoid worrying over future failures.","Avoid Emergency Reliance: Guarantee consistent revenue by filling service bays with scheduled, profitable work.","Clients used to ignore preventative maintenance until their car broke down. By offering a discount on scheduled checkups and centralizing the system in a customer loyalty app, planned work has replaced most emergencies. It's stabilized our shop's income and improved customer safety.",Kevin O’Connell,Dependable Auto Care
Bakery,bakery,68df026d0133a76106f67e29,68cc952cdf0724cd25ca06a3,68df211652624bf0e51ad8b4,false,false,Fri Oct 03 2025 01:04:22 GMT+0000 (Coordinated Universal Time),Fri Oct 03 2025 01:04:22 GMT+0000 (Coordinated Universal Time),Fri Oct 03 2025 02:42:28 GMT+0000 (Coordinated Universal Time),Bakery Loyalty App: Capture Repeat Corporate & Catering Sales,Capture Repeat Corporate & Catering Orders for your Bakery for $650/mo.,"Secure High-Volume, Repeat Corporate and Event Catering Orders.",Build community around your Bakery with Buildify. Loyalty made simple at $650/mo.,"Not incentivizing pre-orders or large take-home purchases with a loyalty bonus means clients only use your bakery for special occasions, losing out on easy, dependable weekly revenue.","By early Monday, implement tiered credits for weekly pre-orders. Use a branded app to push notifications about exclusive specials, securing dependable weekly revenue.",Secure Dependable Weekly Revenue with Pre-Order Loyalty Bonuses.,"Implement Tiered Credits: Offer credits for weekly pre-orders, securing steady, high-margin business.","Stop Sporadic Use: Use a branded app to push notifications about exclusive specials, ensuring clients pre-order weekly.",Capture Dependable Revenue: Guarantee dependable weekly revenue by incentivizing pre-orders and large take-home purchases.,"We needed a better way to incentivize large, recurring catering orders. By implementing automated reservation rewards for consistent large group bookings and pushing reminders via our loyalty platform, we ensured consistent, high-ticket volume. We've locked in our best corporate clients.",Sofia Karras,The Rolling Pin Bakery
Bar,bar,68df026d0133a76106f67e29,68cc952cdf0724cd25ca06a3,68df2117eda329be9100334f,false,false,Fri Oct 03 2025 01:04:23 GMT+0000 (Coordinated Universal Time),Fri Oct 03 2025 01:04:23 GMT+0000 (Coordinated Universal Time),Fri Oct 03 2025 02:42:28 GMT+0000 (Coordinated Universal Time),Bar Loyalty App: Guarantee High-Value Tabs & Patron Retention,Guarantee Loyalty and High-Value Bar Tabs for your Bar for $650/mo.,Drive Weeknight Traffic and Increase High-Margin Drinks with Exclusive Offers.,Build community around your Bar with Buildify. Launch your loyalty app today for $650/mo.,"Without a simple happy hour rewards tier for dedicated patrons, your bar loses the reliable income from regulars who will instead gravitate toward any local venue offering a consistent deal.","Before the week begins, reward late-night visits with a happy hour discount tier. Schedule redemptions directly through your mobile loyalty platform to secure reliable evening traffic.",Secure Reliable Evening Traffic by Rewarding Dedicated Patrons.,Reward Late-Night Visits: Offer a happy hour discount tier for consistent evening patrons.,Eliminate Competitor Draw: Schedule redemptions directly through your mobile loyalty platform to prevent regulars from gravitating toward a consistent deal elsewhere.,Secure Reliable Income: Guarantee the reliable income from regulars by ensuring they feel valued at your venue.,"We lost high-value regulars to flashier competitors. By setting VIP entry credits for repeat high-value guests managed directly in a client app, we ensure future large-scale bottle service bookings. Our regulars feel recognized and appreciated.",Ryan Miller,The Blind Tiger
Barbershop,barbershop,68df026d0133a76106f67e29,68cc952cdf0724cd25ca06a3,68df2118bee2dd79c7b9eb21,false,false,Fri Oct 03 2025 01:04:24 GMT+0000 (Coordinated Universal Time),Fri Oct 03 2025 01:04:24 GMT+0000 (Coordinated Universal Time),Fri Oct 03 2025 02:42:28 GMT+0000 (Coordinated Universal Time),Barbershop App: Secure Predictable Bi-Weekly Bookings,Secure Predictable Bi-Weekly Barbershop Bookings for your business for $650/mo.,Secure Predictable Bi-Weekly Bookings and Turn First-Timers into Lifelong Clients.,Turn first-time visitors into loyal patrons at your Barbershop with Buildify. Loyalty made simple at $650/mo.,"Skipping the creation of a ""Gentleman's Club"" membership with priority booking and discounted services ensures you lose the opportunity to secure reliable, bi-weekly chair time.","Before your employees clock in for the day, offer loyalty points for product purchases and pre-booked appointments. Schedule redemptions directly through your mobile loyalty platform to secure reliable retail revenue.","Secure Reliable, Bi-Weekly Chair Time with Exclusive Memberships.",Offer Loyalty Points: Implement loyalty points for product purchases and pre-booked appointments for members.,Secure Reliable Retail: Schedule redemptions directly through your mobile loyalty platform to secure reliable retail revenue.,"Gentleman's Club: Stop losing the opportunity to secure reliable, bi-weekly chair time with an exclusive membership.","We lost the opportunity to secure reliable, bi-weekly chair time. By offering loyalty points for product purchases and pre-booked appointments scheduled directly through our mobile loyalty platform, we secure reliable retail revenue. Our exclusive membership is driving consistency.",Ben Carter,The Gentlemen's Chair
Barre Studio,barre-studio,68df026d0133a76106f67e29,68cc952cdf0724cd25ca06a3,68df211e97d89ae5d91df8d3,false,false,Fri Oct 03 2025 01:04:30 GMT+0000 (Coordinated Universal Time),Fri Oct 03 2025 01:04:30 GMT+0000 (Coordinated Universal Time),Fri Oct 03 2025 02:42:28 GMT+0000 (Coordinated Universal Time),Barre Studio App: Boost Member Motivation & Loyalty,Boost Member Motivation & Long-Term Loyalty for your Barre Studio for $650/mo.,"Increase Class Pack Renewals and Build a Dedicated, Consistent Community.",Keep loyal members coming back to your Barre Studio with Buildify. Get started for $650 per month.,"Ignoring the chance to reward consistent class attendance ensures members seeking ""Barre workout near me"" lose motivation and drop out, missing the full value of their fitness commitment.","Over the weekend, implement tiered credits for post-treatment checkups. Automate follow-ups and tracking through a branded rewards app to secure predictable, high-margin resolution work.",Ensure Full Commitment Value by Rewarding Class Consistency.,Implement Tiered Credits: Offer tiered credits for consistent class attendance and post-treatment checkups.,"Predictable Resolution: Automate follow-ups and tracking through a branded rewards app to secure predictable, high-margin resolution work.","Stop Loss of Motivation: Stop members seeking ""Barre workout near me"" from losing motivation and dropping out.","Members lost motivation and dropped out, missing the full value of their fitness. By implementing tiered credits for post-treatment checkups (consistent class attendance rewards) and automating follow-ups through a branded rewards app, we secure predictable, high-margin resolution work. We've secured their long-term fitness commitment.",Chloe Davies,The Barre Method
Bed Bug Specialist,bed-bug-specialist,68df026d0133a76106f67e29,68cc952cdf0724cd25ca06a3,68df21152a295ba5b604b84a,false,false,Fri Oct 03 2025 01:04:21 GMT+0000 (Coordinated Universal Time),Fri Oct 03 2025 01:04:21 GMT+0000 (Coordinated Universal Time),Fri Oct 03 2025 02:42:28 GMT+0000 (Coordinated Universal Time),Bed Bug Specialist App: Guarantee Follow-Up Inspections & Trust,Guarantee Follow-Up Inspections & Full Payment for your Bed Bug Specialist for $650/mo.,Build Immediate Trust and Ensure Follow-Up Inspections for Complete Treatment.,Keep loyal customers coming back to your Bed Bug Specialist with Buildify. A loyalty app starting at $650/mo.,"Failing to incentivize future treatments leaves clients anxious about recurrence, causing them to doubt your comprehensive approach and seek out another specialist's guarantee that includes follow-up deals.","By early Monday, implement tiered credits for post-treatment checkups. Automate follow-ups and tracking through a branded rewards app to secure predictable, high-margin resolution work.","Secure Predictable, High-Margin Post-Treatment Resolution Work.",Implement Tiered Credits: Offer credits for post-treatment checkups to alleviate anxiety about recurrence.,Guarantee Comprehensive Approach: Automate follow-ups and tracking to secure the client's faith in your method.,"Predictable Resolution Work: Secure predictable, high-margin resolution work with a clear, reliable follow-up deal.","Clients didn't commit to follow-up inspections after the initial treatment. Since implementing tiered credits for package upgrades and retail purchases and automating tracking through a branded rewards app, we secure predictable, high-margin product sales. We're now the full-solution provider for total peace of mind.",Nancy Koo,Eradicate Bed Bug Solutions
